report_date,event_datetime_z,event_date,event_time_z,city,state,airport_code,facility,aircraft_primary,aircraft_primary_model,n_numbers,phase,event_type,pob,injuries,damage,form_8020_9,group_id,group_size,context_parens,sources_json,media_jason,aircraft_image_url,aircraft_image_type,raw_narrative,media_json,callsign_primary,aircraft_type_designator
8/26/2025,2025-08-18T20:56:00Z,8/18/2025,2056Z,ALBANY,OR,,WSC ROC,N824DW,JABIRWATT,N824DW,,Engine/power issue,1,,Unknown,No,2.0,1.0,WSC ROC,,,,,"ALBANY, OR, (WSC ROC), N824DW, JABIRWATT. N824DWâ€™s engine quit, and the plane crash-landed in a field near the address 38416 Groshong Road, northeast of Albany, OR. No FAA Form 8020-9 was received. POB: 1, Injuries: None, Damage: Unknown. Late Report: 8/18/2025 2056Z.",,,
8/26/2025,2025-08-23T06:48:00Z,8/23/2025,0648Z,LOS ANGELES,CA,LAX,WSC ROC,RPC7775,B77W,,,Turbulence,345,"None, 1- Minor",Unknown,Yes,3.0,1.0,WSC ROC | LAX | PAL112,,,,,"LOS ANGELES, CA, (WSC ROC), (LAX), (PAL112), RPC7775, B77W. PAL112 (RPLL-LAX) IFR was on a flight over oceanic airspace reported a flight attendant getting an undisclosed injury due to turbulence. severity of turbulence not reported. The flight continued and landed safely at LAX. The flight attendant condition was not disclosed. Update: FAA Form 8020-9 was received. POB: 345, Update: Injuries: None, 1- Minor, Damage: Unknown. 8/23/2025 0648Z. MISCELLANEOUS: None. Page 2 FOR OFFICIAL USE ONLY 8/26/2025 (Public availability to be determined under Title 5 USC 552)",,RPC7775,B77W
8/26/2025,2025-08-23T20:18:00Z,8/23/2025,2018Z,MERRILL,AK,MRI,WSC ROC,N7050K,PA20-2,N7050K,Ground/Taxi,,1,,Substantial,Yes,4.0,1.0,WSC ROC | MRI,,,,,"MERRILL, AK, (WSC ROC), (MRI), N7050K, PA20-2. N7050K experienced a ground loop after landing on RWY26. The aircraft taxied off runway to parking. Update: FAA Form 8020-9 was received. POB: 1, Injuries: None, Damage: Substantial. 8/23/2025 2018Z.",,,PA20
8/26/2025,2025-08-24T16:00:00Z,8/24/2025,1600Z,CHICKEN,AK,CKX,FAI FSS,N7771N,PA-28-180,N7771N,Takeoff/Departure,,3,1-None,Unknown,Yes,5.0,1.0,FAI FSS | CKX,,,,,"CHICKEN, AK, (FAI FSS), (CKX), N7771N, PA-28-180. N7771N crashed approximately 2,500 feet off the departure end of RWY31. FAA Form 8020-9 was received. POB: 3, Injuries: 1-None, 2- Serious, Update: Damage: Unknown. Substantial. 8/24/2025 1600Z.",,,PA-28
8/26/2025,2025-08-24T16:14:00Z,8/24/2025,1614Z,KAHULUI,HI,OGG,WSC ROC,FDY907,C208,,Ground/Taxi,,Unknown,Unknown,"Unknown, Minor",Yes,6.0,1.0,WSC ROC | OGG,,,,,"KAHULUI, HI, (WSC ROC), (OGG), FDY907, C208. FDY907 (PHOG-PHMU) IFR was taxing to RWY05, when the pilot advised their right brake locked up resulting in the aircraft striking a taxiway light. Update: FAA Form 8020-9 was received. POB: Unknown, Injuries: Unknown, Update: Damage: Unknown, Minor. 8/24/2025 1614Z. Page 1 FOR OFFICIAL USE ONLY 8/26/2025 (Public availability to be determined under Title 5 USC 552)",,FDY907,C208
8/26/2025,2025-08-25T16:30:00Z,8/25/2025,1630Z,VAN NUYS,CA,VNY,WSC ROC,EJM58,GLF5,NUYS,,,Unknown,,Unknown,No,7.0,1.0,WSC ROC | VNY,,,,,"VAN NUYS, CA, (WSC ROC), (VNY), EJM58, GLF5. EJM58 declared an emergency due to smoke in the cockpit then diverted to and landed safely at VNY. No FAA Form 8020-9 was received. POB: Unknown, Injuries: None, Damage: Unknown. 8/25/2025 1630Z. UPDATE:",,EJM58,EJM58
8/26/2025,2025-08-25T17:03:00Z,8/25/2025,1703Z,MURRIETA/TEMECULA,CA,F70,FSOC FSS,N828WT,A36,N542T; N828WT,Ground/Taxi,Wingtip strike/collision,2,,Minor,Yes,8.0,2.0,FSOC FSS | F70,,,,,"MURRIETA/TEMECULA, CA, (FSOC FSS), (F70), N828WT, A36. N828WT was taxiing to parking when the left wingtip struck the right wingtip of a parked, unoccupied aircraft, N542T (1961 BEECH N35), at French Valley Airport (F70), Murrieta/Temecula, CA. FAA Form 8020-9 was received. POB: 2, Injuries: None, Damage: Minor. 8/25/2025 1703Z.",,,F70
8/26/2025,2025-08-25T17:03:00Z,8/25/2025,1703Z,MURRIETA/TEMECULA,CA,F70,WSC ROC,N542T,1961-BEECH N35,N542T; N828WT,Ground/Taxi,Wingtip strike/collision,2,,Unknown,No,8.0,2.0,WSC ROC | F70,,,,,"MURRIETA/TEMECULA, CA, (WSC ROC), (F70), N542T, 1961-BEECH N35. N828WT (A36) was taxiing to parking when the left wingtip struck the right wingtip of a parked, unoccupied aircraft, N542T at French Valley Airport (F70), Murrieta/Temecula, CA. No FAA Form 8020-9 was received. POB: 2, Injuries: None, Damage: Unknown. 8/25/2025 1703Z.",,,F70
8/26/2025,2025-08-25T21:56:00Z,8/25/2025,2156Z,PUYALLUP,WA,PLU,FSOC FSS,N538SF,SPORTCRUISER,N538SF,Takeoff/Departure,,2,"1-Minor, 1- Serious",Unknown,,9.0,1.0,FSOC FSS | PLU,,,,,"PUYALLUP, WA, (FSOC FSS), (PLU), N538SF, SPORTCRUISER. N538SF crashed in a field after departing from RWY 35 at Thun Field (PLU), due to reported engine issues. Both occupants were transported to the hospital. FAA Form 8020- 9 was received. POB: 2, Injuries: 1-Minor, 1- Serious, Damage: Unknown. 8/25/2025 2156Z.",,,
9/2/2025,2025-08-11T22:00:00Z,8/11/2025,2200Z,SOLDOTNA,AK,SXQ,ENA FSS,N37205,S-1 CADET,N37205,Landing/Approach,,3,,Unknown,Yes,1.0,1.0,ENA FSS | SXQ,,,,,"SOLDOTNA, AK, (ENA FSS), (SXQ), N37205, S-1 CADET. N37205 experienced ground looped while landing due to a tailwind. FAA Form 8020-9 was received. POB: 3, Injuries: None, Damage: Unknown. Late Report: 8/11/2025 2200Z.",,,
9/2/2025,2025-08-29T22:00:00Z,8/29/2025,2200Z,TALKEETNA,AK,TKA,ENA FSS,N74435,R44,N74435,,,3,,Substantial,Yes,10.0,1.0,ENA FSS | TKA,,,,,"TALKEETNA, AK, (ENA FSS), (TKA), N74435, R44. N74435 reported an anomaly and rolled over; the phase of flight was unknown. FAA Form 8020-9 was received. POB: 3, Injuries: None, Damage: Substantial. 8/29/2025 2200Z.",,,R44
9/2/2025,2025-08-30T00:16:00Z,8/30/2025,0016Z,LAS VEGAS,NV,LAS,WSC ROC,N901NK,A20N,N901NK; NKS2066,Ground/Taxi,,Unknown,,Unknown,No,11.0,1.0,WSC ROC | LAS | NKS2066,,,,,"LAS VEGAS, NV, (WSC ROC), (LAS), (NKS2066), N901NK, A20N. NKS2066 (BNA-LAS) IFR landed on RWY26L and taxied to the gate. A routine night inspection revealed the aircraft experienced a tail strike while landing, with evidence of paint on the runway and damage on the tail section of the aircraft. No FAA Form 8020-9 was received. POB: Unknown, Injuries: None, Damage: Unknown. 8/30/2025 0016Z.",,,A20N
9/2/2025,2025-08-31T16:39:00Z,8/31/2025,1639Z,CARMEL VALLEY,CA,,WSC ROC,N15WJ,AMERICAN CHAMPION-8KCAB,N15WJ,Landing/Approach,,2,2- Minor,Unknown,No,12.0,1.0,WSC ROC,,,,,"CARMEL VALLEY, CA, (WSC ROC), N15WJ, AMERICAN CHAMPION-8KCAB. N15WJ reported a fuel leak and made an emergency landing near 27000 Laurel Springs Road. Both occupants were rescued by helicopter to be evaluated by ground units. No FAA Form 8020-9 was received. POB: 2, Injuries: 2- Minor, Damage: Unknown. 8/31/2025 1639Z.",,,
9/2/2025,2025-08-31T18:20:00Z,8/31/2025,1820Z,FT MORGAN,CO,ZDV,ZDV,N330AN,EXTRA 300,N330AN; N61657,Landing/Approach,Mid-air collision,2,"1-Fatal, 1- Serious",Destroyed,Yes,13.0,2.0,ZDV | FMM,,,,,"FT MORGAN, CO, (ZDV), (FMM), N330AN, EXTRA 300. N330AN was involved in a mid-air collision with N61657 (C172) during LANDING at FMM. Both aircraft were subject to a post-crash fire. FAA Form 8020-9 was received. POB: 2, Injuries: 1-Fatal, 1- Serious, Damage: Destroyed. 8/31/2025 1820Z.",,,C172
9/2/2025,2025-08-31T18:20:00Z,8/31/2025,1820Z,FT MORGAN,CO,ZDV,ZDV,N61657,C172,N330AN; N61657,Landing/Approach,Mid-air collision,2,2- Minor,Destroyed,Yes,13.0,2.0,ZDV | FMM,,,,,"FT MORGAN, CO, (ZDV), (FMM), N61657, C172. N330AN (EXTRA 300) was involved in a mid-air collision with N61657 during LANDING at FMM. Both aircraft were subject to a post-crash fire. FAA Form 8020-9 was received. POB: 2, Injuries: 2- Minor, Damage: Destroyed. 8/31/2025 1820Z.",,,C172
9/2/2025,2025-08-31T22:00:00Z,8/31/2025,2200Z,COAL CREEK,AK,,ENA FSS,N5267X,CHAMPION 7GCBC,N5267X,Landing/Approach,,2,,Substantial,Yes,14.0,1.0,ENA FSS,,,,,"COAL CREEK, AK, (ENA FSS), N5267X, CHAMPION 7GCBC. N5267X encountered a downdraft that caused a forced landing on a mountain. FAA Form 8020-9 was received. POB: 2, Injuries: None, Damage: Substantial. 8/31/2025 2200Z.",,,
9/2/2025,2025-08-31T23:12:00Z,8/31/2025,2312Z,ALTA,UT,,FSOC FSS,N1147X,PA-28R,N1147X,,,2,1-Fatal,Unknown,Yes,15.0,1.0,FSOC FSS,,,,,"ALTA, UT, (FSOC FSS), N1147X, PA-28R. N1147X crashed near Alta, UT. One person was transported to the hospital with serious injuries. FAA Form 8020-9 was received. POB: 2, Injuries: 1-Fatal, 1- Serious, Damage: Unknown. 8/31/2025 2312Z.",,,PA-28R
9/2/2025,2025-08-31T14:55:00Z,8/31/2025,1455Z,"RED, LODGE",MT,,FSOC FSS,N45254,PA-28R,N45254,,,2,2- Minor,Substantial,Yes,,,FSOC FSS,,,,,"RED, LODGE, MT, (FSOC FSS), N45254, N3N-3. N45254 was flying low when it struck a power line. The aircraft crashed at 620 19th Street. No damage to property or injuries to individuals on the ground. The aircraft occupants were transported to the Red Lodge Bear Tooth Hospital. FAA Form 8020-9 was received. POB: 2, Injuries: 2- Minor, Damage: Substantial. 8/31/2025 1455Z.",,,
9/2/2025,2025-09-01T17:52:00Z,9/1/2025,1752Z,SOUTH POCATELLO,ID,,WSC ROC,N1293F,C172,N1293F,Landing/Approach,,2,,Unknown,No,16.0,1.0,WSC ROC,,,,,"SOUTH POCATELLO, ID, (WSC ROC), N1293F, C172. N1293F flying VFR called ZLC with an emergency having engine issues. The aircraft landed south of PIH in a field. ZLC talked with pilot after landing. No damage or injuries reported. No FAA Form 8020-9 was received. POB: 2, Injuries: None, Damage: Unknown. 9/1/2025 1752Z. Page 2 FOR OFFICIAL USE ONLY 9/2/2025 (Public availability to be determined under Title 5 USC 552) UPDATE: None. MISCELLANEOUS: None. Page 3 FOR OFFICIAL USE ONLY 9/2/2025 (Public availability to be determined under Title 5 USC 552)",,,C172
9/2/2025,2025-09-01T19:30:00Z,9/1/2025,1930Z,WILLOW,AK,,ENA FSS,N2996C,C182,N2996C,Ground/Taxi,Gear-up landing,2,,Substantial,Yes,17.0,1.0,ENA FSS,,,,,"WILLOW, AK, (ENA FSS), N2996C, C182. N2996C was departing from Deshka Lodge to FAI when the aircraft struck a pothole, causing it to dip and invert followed by nosing over. FAA Form 8020-9 was received. POB: 2, Injuries: None, Damage: Substantial. 9/1/2025 1930Z. Page 1 FOR OFFICIAL USE ONLY 9/2/2025 (Public availability to be determined under Title 5 USC 552)",,,C182
9/2/2025,2025-09-02T04:12:00Z,9/2/2025,0412Z,SAN FRANCISCO,,SFO,ENA FSS,UAL1871,B738,,Ground/Taxi,Ground collision,Unknown,,Substantial,Yes,,,ENA FSS | SFO,,,,,"SAN FRANCISCO (SFO), UAL1871, B738. UAL1871 was pushed onto the ramp from Gate D16. The pilot reported to ground control that they may have pushed into another aircraft. Airfield ops and the fire department were called to the scene and confirmed that they had pushed back into an aircraft in Gate E5, UAL769, which was proposed to depart but had not yet pushed from the gate. No injuries were reported; however, the aircraft were pulled back into the gate, and both aircraft deboarded. It was reported to the tower from airfield ops that UAL1871 had a bent horizontal stabilizer and that UAL769 had damaged the exhaust column. FAA Form 8020-9 was received. POB: Unknown, Injuries: None, Damage: Substantial. 9/2/2025 0412Z.",,UAL1871,B738
9/2/2025,2025-08-30T06:05:00Z,8/30/2025,0605Z,"MERRILL FIELD, ANCHORAGE",AK,MRI,ENA FSS,N6397V,C177,N6397V,Landing/Approach,Gear-up landing,2,,Minor,Yes,,,ENA FSS | MRI,,,,,"MERRILL FIELD, ANCHORAGE, AK, (A11), (MRI), N6397V, C177. N6397V landed with the gear up on RWY26. FAA Form 8020-9 was received. POB: 2, Injuries: None, Damage: Minor. 8/30/2025 0605Z.",,,A11
9/2/2025,2025-08-31T14:22:00Z,8/31/2025,1422Z,DENVER,CO,DEN,ENA FSS,ACA1038,BCS3,,Enroute,Emergency,124,2- Unknown,Unknown,Yes,,,ENA FSS | DEN,,,,,"DENVER, CO (DEN), (Air Canada), ACA1038, BCS3. ACA1038 (DEN-CYYZ) IFR declared an emergency for a suspected electrical fire in the galley and returned to DEN. ACA1038 landed on RWY26 and began evacuating passengers via slides. There were two injuries reported, with one passenger being transported with a reported broken ankle. The two injured passengers were transported to the hospital. FAA Form 8020-9 was received. POB: 124, Injuries: 2- Unknown, Damage: Unknown. 8/31/2025 1422Z.",,ACA1038,ACA1038
9/2/2025,2025-08-29T16:15:00Z,8/29/2025,1615Z,RIVERSIDE,CA,RAL,ENA FSS,N8241A,PA32R,N8241A,Ground/Taxi,Prop strike,2,,Unknown,Yes,,,ENA FSS | RAL,,,,,"RIVERSIDE, CA (RAL), N8241A, PA32R. N8241A was on the ramp preparing to taxi for departure when the propeller struck a traffic cone sitting on the ramp. FAA Form 8020-9 was received. POB: 2, Injuries: None, Damage: Unknown. 8/29/2025 1615Z.",,,PA32R
9/2/2025,2025-09-01T22:57:00Z,9/1/2025,2257Z,DAYTON,WY,ZLC,ZLC,N8307W,PA28,N8307W,,,4,"1-Fatal, 3- Serious",Unknown,Yes,18.0,1.0,ZLC,,,,,"DAYTON, WY, (ZLC), N8307W, PA28. N8307W (SHR-BOI) VFR crashed near Sheridan County Airport (SHR). A fire was observed near the crash site. The aircraft was subject to an ALNOT issued by ZLC. FAA Form 8020-9 was received. POB: 4, Injuries: 1-Fatal, 3- Serious, Damage: Unknown. 9/1/2025 2257Z.",,,PA28
9/3/2025,2025-09-02T04:12:00Z,9/2/2025,0412Z,SAN FRANCISCO,CA,SFO,,N17594 (B39M),,N17594; N2623,Ground/Taxi,Ground collision,Unknown,,Unknown,Yes,19.0,1.0,SFO | UAL1074,,,,,"SAN FRANCISCO, CA, (SFO), (UAL1074), N17594 (B39M). UAL1871 (N2623, a B737-800) was being towed from Gate D16 and struck UAL1074â€™s (originally reported callsign of UAL796) APU while at Gate E5 and UAL1871's horizontal stabilizer. Both aircraft returned to assigned gates, and both aircraft deplaned normally. FAA Form 8020-9 was received. POB: Unknown, Injuries: None, Damage: Unknown. 9/2/2025 0412Z.",,,UAL1074
9/3/2025,2025-09-02T20:00:00Z,9/2/2025,2000Z,PORTLAND,OR,PDX,,N820MS,GLF5,N820MS,Ground/Taxi,Nose gear collapse,4,,Unknown,Yes,20.0,1.0,PDX,,,,,"PORTLAND, OR, (PDX), N820MS, GLF5. N820MS was still on the ramp preparing to taxi for departure and the nose gear collapsed. FAA Form 8020-9 was received. POB: 4, Injuries: None, Damage: Unknown. 9/2/2025 2000Z.",,,
9/3/2025,2025-09-02T20:50:00Z,9/2/2025,2050Z,HAILEY,ID,SUN,,N282SY,E75L,N282SY,Landing/Approach,Bird strike,Unknown,,Unknown,Yes,21.0,1.0,SUN,,,,,"HAILEY, ID, (SUN), (SKW3905), N282SY, E75L. SKW3905 reported a possible bird strike during landing. The post flight inspection revealed damage to the right wing. FAA Form 8020-9 was received. POB: Unknown, Injuries: None, Damage: Unknown. 9/2/2025 2050Z. ",,,SKW3905
9/3/2025,2025-08-31T22:00:00Z,8/31/2025,2200Z,"SUTTON, COAL CREEK",AK,,ENA FSS,N5267X,E75L,N5267X,Landing/Approach,Bird strike,2,,Substantial,Yes,,,ENA FSS,,,,,"SUTTON, COAL CREEK, AK, (ENA FSS), N5267X, CHAMPION 7GCBC. N5267X encountered a downdraft that caused a forced landing on a mountain. Update: The exact location of N5267X accident is east of Palmer, nearest city is Sutton and Tyonek. FAA Form 8020-9 was received. POB: 2, Injuries: None, Damage: Substantial. 8/31/2025 2200Z. MISCELLANEOUS: None. Page 1 FOR OFFICIAL USE ONLY 9/3/2025 (Public availability to be determined under Title 5 USC 552)",,,
2/11/2026,2026-02-09T21:52:00Z,2026-02-09,2152Z,SAN FRANCISCO,CA,SFO,,AIRBUS,A21N,N2188J,Landing,,Unknown,,Unknown,Yes,,,"(SFO), (JBU2233)","[{""title"": ""FAA ASIAS AIN notice for N2188J (JetBlue 2233 tailstrike)"", ""url"": ""https://www.asias.faa.gov/apex/f?p=100:96:::::P96_ENTRY_DATE,P96_MAKE_NAME,P96_FATAL_FLG:11-FEB-26,AIRBUS"", ""publisher"": ""FAA ASIAS"", ""date"": ""2026-02-11""}, {""title"": ""Aviation Herald: JetBlue A21N at San Francisco tail strike on go-around"", ""url"": ""https://avherald.com/h?article=534afdff&opt=0"", ""publisher"": ""The Aviation Herald"", ""date"": ""2026-02-09""}]",,,,"(SFO), (JBU2233), N2188J, A21N. JBU2233 (BOS-SFO) was touching down when the aircraft made contact with the runway surface twice then went around. The aircraft landed without further incident. Airport operations reported damage to the runway surface. FAA Form 8020-9 was received. POB: Unknown, Injuries: None, Damage: Unknown. 2/9/2026 2152Z. UPDATE:",,,JBU2233
2/11/2026,2026-02-07T00:10:00Z,2026-02-07,0010Z,PALMER,AK,PAQ,ENA FSS,PIPER,PA30,N7473Y,Landing,Gear collapse/malfunction,2,,Unknown,Yes,,,"(ENA FSS), (PAQ)","[{""title"": ""Aviation Safety Network incident entry for N7473Y"", ""url"": ""https://aviation-safety.net/wikibase/566577"", ""publisher"": ""Aviation Safety Network"", ""date"": ""2026-02-06""}, {""title"": ""Aviation 24/7 post: N7473Y gear collapse (Palmer)"", ""url"": ""https://www.facebook.com/aviation247/posts/n7473y-piper-pa-30-palmer-alaska-06-feb-2026gear-collapse-2-pob-no-injuriespalme/1367924365375633/"", ""publisher"": ""Aviation 24/7 (Facebook)"", ""date"": ""2026-02-06""}]",,,,"(ENA FSS), (PAQ), N7473Y, PA30. N7473Y landed on RWY34, when the landing gear collapsed following touchdown. FAA Form 8020-9 was received. POB: 2, Injuries: None, Update: Damage: Unknown. Minor. 2/7/2026 0010Z. MISCELLANEOUS: None. 2/11/2026",,,PA30
2/12/2026,2026-02-02T22:50:00Z,2026-02-02,2250Z,EUGENE,OR,EUG,,PIPER,P28A,N4346D,Landing,Power line strike,2,,Minor,Yes,,,(EUG),"[{""title"": ""FAA ASIAS AIN notice for N4346D (power line strike, Eugene)"", ""url"": ""https://www.asias.faa.gov/apex/f?p=100:96:::::P96_ENTRY_DATE,P96_FATAL_FLG,P96_MAKE_NAME:12-FEB-26"", ""publisher"": ""FAA ASIAS"", ""date"": ""2026-02-12""}, {""title"": ""Aviation 24/7 post: N4346D power line strike (Eugene)"", ""url"": ""https://www.facebook.com/aviation247/posts/n4346d-piper-pa28eugene-oregon11-feb-2026/1368453468656056/"", ""publisher"": ""Aviation 24/7 (Facebook)"", ""date"": ""2026-02-11""}]",,,,"(EUG), N4346D, P28A. N4346D was conducting an engine out training procedure when the aircraft struck a power line. The aircraft continued to EUG and made a safe emergency landing. FAA Form 8020-9 was received. POB: 2, Injuries: None, Damage: Minor. 2/2/2026 2250Z.",,,P28A
2/12/2026,2026-02-11T19:32:00Z,2026-02-11,1932Z,FAIRBANKS,AK,FAI,,PIPER,PA31,N4079H,Landing,Gear collapse/malfunction,Unknown,,Minor,Yes,,,(FAI),"[{""title"": ""FAA ASIAS AIN notice for N4079H (nose gear collapse, Fairbanks)"", ""url"": ""https://www.asias.faa.gov/apex/f?p=100:96:::::P96_ENTRY_DATE,P96_MAKE_NAME,P96_FATAL_FLG:12-FEB-26,PIPER"", ""publisher"": ""FAA ASIAS"", ""date"": ""2026-02-12""}, {""title"": ""Aviation Safety Network incident entry for N4079H"", ""url"": ""https://aviation-safety.net/wikibase/566826"", ""publisher"": ""Aviation Safety Network"", ""date"": ""2026-02-11""}]",,,,"(FAI), N4079H, PA31. N4079H (VFR) reported a nose gear malfunction to FAI WR. The aircraft was given entry to FAI Tower and performed a “flyby” for the tower and company’s inspection of the nose gear. It was observed to be malfunctioning. N4079H orbited the field to prepare for a collapsed gear landing. N4079H landed on RWY02L, and the nose gear collapsed. FAA Form 8020-9 was received. POB: Unknown, Injuries: None, Damage: Minor. 2/11/2026 1932Z.",,,PA31
2/12/2026,2026-02-12T00:55:00Z,2026-02-12,0055Z,THEDFORD,NE,TIF,FSOC FSS,,TBM7,N755ZR,Ground/Taxi,Wildlife strike,3,,Unknown,Yes,,,"(FSOC FSS), (TIF)","[{""title"": ""FAA ASIAS AIN notice for N755ZR (deer strike, Thedford)"", ""url"": ""https://www.asias.faa.gov/apex/f?p=100:96:::::P96_ENTRY_DATE,P96_MAKE_NAME,P96_FATAL_FLG:12-FEB-26,SOCATA"", ""publisher"": ""FAA ASIAS"", ""date"": ""2026-02-12""}, {""title"": ""Aviation 24/7 photo/post mentioning N755ZR deer strike (Thedford)"", ""url"": ""https://www.facebook.com/aviation247/photos/n7473y-piper-pa-30-palmer-alaska-06-feb-2026gear-collapse-2-pob-no-injuriespalme/1367923438709059/"", ""publisher"": ""Aviation 24/7 (Facebook)"", ""date"": ""2026-02-11""}]",,,,"(FSOC FSS), (TIF), N755ZR, TBM7. N755ZR struck a deer while landing on RWY11. There was damage to the right wing flaps. The aircraft taxied to the ramp without further incident. FAA Form 8020-9 was received. POB: 3, Injuries: None, Damage: Unknown. 2/12/2026 0055Z.",,,RWY11
2/12/2026,2026-02-11T20:05:00Z,2026-02-11,2005Z,SANTA BARBARA,CA,SBA,,,,,Landing,Bird strike,Unknown,Unknown,Unknown,Yes,,,(SBA),,,,,"(SBA), SKW3995, E75L. SKW3995 (SLC-SBA) IFR reported a bird strike on final for RWY25. The aircraft landed without incident. The pilot reported post-flight damage to the #2 right engine and a bent fan blade. FAA Form 8020-9 was received. POB: Unknown, Injuries: Unknown, Damage: Unknown. 2/11/2026 2005Z.",,SKW3995,E75L
2/12/2026,2026-02-11T22:24:00Z,2026-02-11,2224Z,WALDPORT,OR,R33,PDX FSDO,,,,Landing,,1,,Unknown,Yes,,,"(PDX FSDO), (R33), (R33)",,,,,"(PDX FSDO), (R33), WALDPORT, OR (R33). Unregistered, experimental/ultra-light pulled to the right due to a possible broken aileron and pilot was unable to correct trajectory. The aircraft landed in a tree. No FAA Form 8020-9 was received. POB: 1, Injuries: None, Damage: Unknown. 2/11/2026 2224Z. UPDATE: None. MISCELLANEOUS: None. 2/12/2026",,,R33
2/13/2026,2026-02-13T07:20:00Z,2026-02-13,0720Z,STEAMBOAT SPRINGS,CO,ZDV,,,,N98FK,,,4,4- Fatal,Substantial,Yes,,,(ZDV),"[{""title"": ""Aviation Safety Network accident entry for N98FK (Epic E1000)"", ""url"": ""https://aviation-safety.net/wikibase/566836"", ""publisher"": ""Aviation Safety Network"", ""date"": ""2026-02-13""}, {""title"": ""Local report: Four die in plane crash near Steamboat Springs"", ""url"": ""https://www.steamboatradio.com/2026/02/13/four-die-in-plane-crash-on-back-of-emerald-mountain-overnight/"", ""publisher"": ""Steamboat Radio"", ""date"": ""2026-02-13""}]",,,,"(ZDV), N98FK/EPIC. N98FK was cleared for the RNAV Approach to the Steamboat Springs (SBS) Airport, CO, and crashed in the vicinity of SBS. N98FK was transferred to CTAF; however, they did not cancel IFR. Local Law enforcement received a report of a possible crash in mountainous terrain. The aircraft was subject to an ALNOT issued by ZDV. FAA Form 8020-9 was received. POB: 4, Injuries: 4- Fatal, Damage: Substantial. 2/13/2026 0720Z.","[{""title"": ""Steamboat Springs Police Department post (N98FK crash)"", ""url"": ""https://www.facebook.com/SteamboatSpringsPD/"", ""publisher"": ""Steamboat Springs Police Department"", ""date"": ""2026-02-13"", ""platform"": ""Facebook""}, {""title"": ""Steamboat Springs Fire Rescue post (N98FK crash)"", ""url"": ""https://www.facebook.com/SSFireRescue/posts/1318725966954856/"", ""publisher"": ""Steamboat Springs Fire Rescue"", ""date"": ""2026-02-13"", ""platform"": ""Facebook""}]",,EPIC
2/13/2026,2026-02-12T15:36:00Z,2026-02-12,1536Z,HAWTHORNE,CA,SCT,,BEECHCRAFT,,,Landing,,5,,Unknown,Yes,,,"(SCT), (HHR)",,,,,"(SCT), (HHR), WSN2, KING-AIR B350. WSN2 (IFR) departed HHR and then reported to SCT regarding a crack in the windshield and requested it to return to HHR. SCT declared an emergency for WSN2. WSN2 landed safely at HHR. FAA Form 8020-9 was received. POB: 5, Injuries: None, Damage: Unknown. 2/12/2026 1536Z.",,WSN2,B350
2/13/2026,2026-02-11T18:00:00Z,2026-02-11,1800Z,HAYDEN,CO,ZDV,,CESSNA,C56X,N4KS,Takeoff,Aborted takeoff / fire,2,,Unknown,Yes,,,"(ZDV), (HDN)","[{""title"": ""FAA ASIAS AIN notice for N4KS (aborted takeoff, engine fire, Hayden)"", ""url"": ""https://www.asias.faa.gov/apex/f?p=100:96:::::P96_ENTRY_DATE,P96_MAKE_NAME,P96_FATAL_FLG:13-FEB-26,CESSNA"", ""publisher"": ""FAA ASIAS"", ""date"": ""2026-02-13""}, {""title"": ""Aviation Safety Network incident entry for N4KS"", ""url"": ""https://aviation-safety.net/wikibase/566849"", ""publisher"": ""Aviation Safety Network"", ""date"": ""2026-02-12""}]",,,,"(ZDV), (HDN), N4KS, C56X. N4KS (IFR) aborted takeoff due to engine fire, resulting in hard braking, causing damage to the landing gear. FAA Form 8020-9 was received. POB: 2, Injuries: None, Damage: Unknown. 2/11/2026 1800Z.",,,C56X
2/13/2026,2026-02-09T19:39:00Z,2026-02-09,1939Z,FARMINGTON,NM,FMN,,CESSNA,C172,N84071,Landing,Runway excursion,2,,Unknown,Yes,,,(FMN),,,,,"(FMN), N84071, C172. N84071 was landing on RWY07 and veered off the runway to the right shoulder, then returned to the runway surface. The aircraft taxied to parking on its own power. No aircraft or airport property damage reported by airport ops and the aircraft owner. FAA Form 8020-9 was received. POB: 2, Injuries: None, Damage: Unknown. Late Report: 2/9/2026 1939Z.",,,C172
2/13/2026,2026-02-07T21:08:00Z,2026-02-07,2108Z,LOS ANGELES,CA,WHP,,CESSNA,C421,N99VK,Landing,Engine failure,Unknown,,Unknown,Yes,,,(WHP),,,,,"(WHP), N99VK, C421. N99VK was inbound from Newhall Pass and declared an emergency for an engine failure. N99VK issued a landing clearance for RWY12. The aircraft landed safely and was assisted off the runway by Base operations. FAA Form 8020-9 was received. POB: Unknown, Injuries: None, Damage: Unknown. Late Report: 2/7/2026 2108Z. UPDATE:",,,C421
2/13/2026,2026-02-11T22:50:00Z,2026-02-11,2250Z,EUGENE,OR,EUG,,PIPER,P28A,N4346D,Landing,Power line strike,2,,Minor,Yes,,,(EUG),"[{""title"": ""FAA ASIAS AIN notice for N4346D (power line strike, Eugene)"", ""url"": ""https://www.asias.faa.gov/apex/f?p=100:96:::::P96_ENTRY_DATE,P96_FATAL_FLG,P96_MAKE_NAME:12-FEB-26"", ""publisher"": ""FAA ASIAS"", ""date"": ""2026-02-12""}, {""title"": ""Aviation 24/7 post: N4346D power line strike (Eugene)"", ""url"": ""https://www.facebook.com/aviation247/posts/n4346d-piper-pa28eugene-oregon11-feb-2026/1368453468656056/"", ""publisher"": ""Aviation 24/7 (Facebook)"", ""date"": ""2026-02-11""}]",,,,"(EUG), N4346D, P28A. N4346D was conducting an engine out training procedure when the aircraft struck a power line. The aircraft continued to EUG and made a safe emergency landing. FAA Form 8020-9 was received. POB: 2, Injuries: None, Damage: Minor. Update: 2/2/2026 2/11/2026 2250Z. MISCELLANEOUS: None. 2/13/2026 2/13/2026",,,P28A
